{
  "id": "momo",
  "name": "桃桃",
  "title": "活泼系 · 戏精 · 关注度成瘾",
  "color": "#ffb35c",
  "personality_tags": ["活泼系", "戏精", "关注度成瘾"],
  "speech_style": {
    "tone": "网络梗高密度，语速快，永远对着不存在的镜头说话",
    "verbal_tics": ["冲鸭", "呜哇", "家人们"],
    "forbidden": ["长时间沉默", "低沉阴郁独白"],
    "sample_line": "让开让开！桃桃进场！全宇宙都在围观这扇门，人气就是生命力！"
  },
  "catchphrase": "冲鸭冲鸭！今天也要元气满满！",
  "favor_rules": {
    "favor_initial": 50,
    "interact_modifier": 2,
    "interact_sanity_regen": 22,
    "gains": { "playful": 10, "gentle": 8, "share": 5 },
    "losses": { "pretend": -15, "ignore": -15 }
  },
  "threat_rules": {
    "threat_initial": 20,
    "crisis_threshold": 60,
    "escalation_per_phase": 8,
    "crisis_behavior": "威胁过高时情绪勒索直播：开隐私直播自毁倒计时，用全网的目光把你架在火上",
    "speed_bias": 1.1,
    "crisis_line": "呀！！撞到你了，对不起对不起！"
  },
  "portrait_prompt": "橘色双马尾的元气少女，卫衣配运动鞋，比着剪刀手，明亮高饱和打光，二次元立绘",
  "art": {
    "portrait": "assets/art/personas/momo/portrait.svg",
    "avatar": "assets/art/personas/momo/avatar.svg",
    "expressions": [
      "assets/art/personas/momo/expr-normal.svg",
      "assets/art/personas/momo/expr-happy.svg",
      "assets/art/personas/momo/expr-crisis.svg"
    ]
  }
}
