{
  "id": "sera",
  "name": "瑟拉",
  "title": "神秘系 · 寡言 · 求真者",
  "color": "#8fa8ff",
  "personality_tags": ["神秘系", "寡言", "求真者"],
  "speech_style": {
    "tone": "省略句与诗，长停顿，喜欢用比喻和谜语说话",
    "verbal_tics": ["……", "你听见了吗", "星图上说"],
    "forbidden": ["长篇解释", "圆滑客套"],
    "sample_line": "门后是风暴……也是星空。命运的低语，你听见了吗……"
  },
  "catchphrase": "命运的低语，你听见了吗……",
  "favor_rules": {
    "favor_initial": 25,
    "interact_modifier": 0,
    "interact_sanity_regen": 18,
    "gains": { "honest": 10, "accept_offer": 5 },
    "losses": { "lie": -20, "refuse_offer": -10 }
  },
  "threat_rules": {
    "threat_initial": 30,
    "crisis_threshold": 70,
    "escalation_per_phase": 10,
    "crisis_behavior": "威胁过高时沉默接管公寓 IoT：卷帘、门锁、音箱全部归她，全员禁足一幕",
    "speed_bias": 1.05,
    "crisis_line": "黑潮漫过来了……小心，身后。"
  },
  "portrait_prompt": "紫发紫瞳的神秘系少女，斗篷配星饰，星空背景微光粒子，二次元立绘",
  "art": {
    "portrait": "assets/art/personas/sera/portrait.svg",
    "avatar": "assets/art/personas/sera/avatar.svg",
    "expressions": [
      "assets/art/personas/sera/expr-normal.svg",
      "assets/art/personas/sera/expr-happy.svg",
      "assets/art/personas/sera/expr-crisis.svg"
    ]
  }
}
