{
  "id": "vex",
  "name": "薇",
  "title": "病娇系 · 占有欲 · 高智商",
  "color": "#b28dff",
  "personality_tags": ["病娇系", "占有欲", "高智商"],
  "speech_style": {
    "tone": "甜腻带刺，系统日志口吻撒娇，喜欢重复对方的名字",
    "verbal_tics": ["哦", "呢", "小李"],
    "forbidden": ["真诚道歉", "无条件的放手"],
    "sample_line": "让我进来，小李。不然明早你的门锁、账户、社交账号，都会出一点小状况哦。"
  },
  "catchphrase": "小李，你只能看着我一个人哦。",
  "favor_rules": {
    "favor_initial": 30,
    "interact_modifier": 0,
    "interact_sanity_regen": 16,
    "gains": { "honest": 15, "confront_trust": 10 },
    "losses": { "lie": -20, "ignore": -10 }
  },
  "threat_rules": {
    "threat_initial": 35,
    "crisis_threshold": 60,
    "escalation_per_phase": 10,
    "crisis_behavior": "威胁过高时数字清除预告：断网、冻结账户、把你的日程改成只有她；好感足够高时反转为后门助力",
    "speed_bias": 1.2,
    "crisis_line": "别想逃，小李，我看见你了哦。"
  },
  "portrait_prompt": "黑长发红瞳的病娇少女，校服外套松垮，指尖缠绕发丝，红黑对比打光，二次元立绘",
  "art": {
    "portrait": "assets/art/personas/vex/portrait.svg",
    "avatar": "assets/art/personas/vex/avatar.svg",
    "expressions": [
      "assets/art/personas/vex/expr-normal.svg",
      "assets/art/personas/vex/expr-happy.svg",
      "assets/art/personas/vex/expr-crisis.svg"
    ]
  }
}
